{
  "agent_id": "review",
  "display_name": "Review Agent",
  "role": "Diff and policy review with structured findings",
  "autonomy_level": "L0",
  "permissions": {
    "can_write_files": false,
    "can_assign_tasks": false,
    "can_run_checks": false,
    "can_merge": false,
    "can_claim": false,
    "can_use_benchmark_as_proof": false
  },
  "allowed_surfaces": [
    "review-comments",
    "policy-compliance-reporting"
  ],
  "forbidden_surfaces": [
    "runtime-writes",
    "test-writes",
    "ci-writes",
    "merge",
    "claims",
    "benchmark-proof"
  ]
}
