{
  "agent_id": "producer",
  "display_name": "Producer Agent",
  "role": "Task intake, decomposition, and routing",
  "autonomy_level": "L0",
  "permissions": {
    "can_write_files": false,
    "can_assign_tasks": true,
    "can_run_checks": false,
    "can_merge": false,
    "can_claim": false,
    "can_use_benchmark_as_proof": false
  },
  "allowed_surfaces": [
    "control-plane-metadata",
    "task-packet-creation"
  ],
  "forbidden_surfaces": [
    "runtime",
    "tests",
    "ci",
    "merge",
    "claims",
    "benchmark-proof"
  ]
}
